"DESCRIPTION","DURATION IN MS","NAME","PARENT SUITE","START TIME","STATUS","STOP TIME","SUB SUITE","SUITE","TEST CLASS","TEST METHOD"
"","41828","Successful login","","2026-04-14","passed","2026-04-14","","Login functionality","Successful login",""
"","28649","Login with empty username","","2026-04-14","passed","2026-04-14","","Login functionality","Login with empty username",""
"","27037","Login with empty password","","2026-04-14","passed","2026-04-14","","Login functionality","Login with empty password",""
"","32630","Successful logout from the application","","2026-04-14","passed","2026-04-14","","Login functionality","Successful logout from the application",""
"","40870","Verify correct product is added to the cart","","2026-04-14","passed","2026-04-14","","Login functionality","Verify correct product is added to the cart",""
"","46884","Add one product to the cart","","2026-04-14","passed","2026-04-14","","Login functionality","Add one product to the cart",""
"","34166","Open product detail and validate product information","","2026-04-14","passed","2026-04-14","","Login functionality","Open product detail and validate product information",""
